Id,Name,English,Source,Descriptor,School,Alchemist,AntiPaladin,Bard,Cleric,Druid,Inquisitor,Summoner,Magus,Oracle,Paladin,Ranger,Witch,Wizard,Components,Range,Target,CastingTime,Summary,FrUrl,EnUrl
control-summoned-creature,Contrôle des créatures convoquées,Control Summoned Creature,um,MindAffecting,Enchantment,,,3,4,,,3,,,,,,4,"Verbal, Somatic",Close,une créature convoquée,SimpleAction,Le personnage dirige un monstre convoqué comme si c'était lui qui l'avait appelé.,http://www.pathfinder-fr.org/Wiki/Pathfinder-RPG.Contrôle des créatures convoquées.ashx,http://paizo.com/pathfinderRPG/prd/ultimateMagic/spells/controlSummonedCreature.html#_control-summoned-creature
control-undead,Contrôle des morts-vivants,Control Undead,,None,Necromancy,,,,,,,,,,,,,7,"Verbal, Somatic, Material",Close,"jusqu’à 2 DV de morts-vivants/niveau, distants de moins de 9 m (6 c) les uns des autres",SimpleAction,Les morts-vivants n'attaquent pas le PJ.,http://www.pathfinder-fr.org/Wiki/Pathfinder-RPG.sort contrôle des morts-vivants.ashx,http://paizo.com/pathfinderRPG/prd/spells/controlUndead#control-undead
control-plants,Contrôle des plantes,Control Plants,,None,Transmutation,,,,,8,,,,,,,,,"Verbal, Somatic, DivineFocus",Close,"jusqu’à 2 DV de créatures végétales/niveau, distantes de moins de 9 m (6 c) les unes des autres",SimpleAction,Permet de contrôler une ou plusieurs créatures végétales.,http://www.pathfinder-fr.org/Wiki/Pathfinder-RPG.Contrôle des plantes.ashx,http://paizo.com/pathfinderRPG/prd/spells/controlPlants#control-plants
control-winds,Contrôle des vents,Control Winds,,Air,Transmutation,,,,,5,,,,,,,,,"Verbal, Somatic",8/level Squares,cylindre de 12 m (8 c) de rayon/niveau et de 12 m de haut,SimpleAction,Modifie la direction et la force du vent.,http://www.pathfinder-fr.org/Wiki/Pathfinder-RPG.Contrôle des vents.ashx,http://paizo.com/pathfinderRPG/prd/spells/controlWinds#control-winds
control-weather,Contrôle du climat,Control Weather,,None,Transmutation,,,,7,7,,,,,,,7,7,"Verbal, Somatic",3 km,zone de 3 km de rayon centrée sur le jeteur de sorts (voir description),10 minutes (voir description),Modifie le climat local.,http://www.pathfinder-fr.org/Wiki/Pathfinder-RPG.Contrôle du climat.ashx,http://paizo.com/pathfinderRPG/prd/spells/controlWeather#control-weather
command-undead,Contrôle mineur des morts-vivants,Command Undead,,None,Necromancy,,,,,,,,,,,,,2,"Verbal, Somatic, Material",Close,1 mort-vivant,SimpleAction,Les morts-vivants obéissent au PJ.,http://www.pathfinder-fr.org/Wiki/Pathfinder-RPG.Contrôle mineur des morts-vivants.ashx,http://paizo.com/pathfinderRPG/prd/spells/commandUndead#command-undead
summon-minor-ally,Convocation d'alliés mineur,Summon Minor Ally,um,None,Conjuration,,,,,1,,,,,,1,,,"Verbal, Somatic, DivineFocus",Close,1d3 créatures invoquées,1 Round,Convoque 1d3 animaux TP.,http://www.pathfinder-fr.org/Wiki/Pathfinder-RPG.Convocation dalliés mineur.ashx,http://paizo.com/pathfinderRPG/prd/ultimateMagic/spells/summonMinorAlly.html#_summon-minor-ally
summon-nature's-ally-i,Convocation d'alliés naturels I,Summon Nature's Ally I,,None,Conjuration,,,,,1,,,,,,1,,,"Verbal, Somatic, DivineFocus",Close,1 créature convoquée,1 Round,Appelle une créature luttant pour le PJ.,http://www.pathfinder-fr.org/Wiki/Pathfinder-RPG.Convocation dalliés naturels I.ashx,http://paizo.com/pathfinderRPG/prd/spells/summonNatureSAlly#summon-nature-s-ally-i
summon-nature's-ally-ii,Convocation d'alliés naturels II,Summon Nature's Ally II,,None,Conjuration,,,,,2,,,,,,2,,,"Verbal, Somatic, DivineFocus",Close,1 créature de niveau 2 ou 1d3 créatures de niveau 1 convoquées,1 Round,Appelle une ou plusieurs créatures luttant pour le PJ.,http://www.pathfinder-fr.org/Wiki/Pathfinder-RPG.Convocation dalliés naturels II.ashx,http://paizo.com/pathfinderRPG/prd/spells/summonNatureSAlly#summon-nature-s-ally-ii
summon-nature's-ally-iii,Convocation d'alliés naturels III,Summon Nature's Ally III,,None,Conjuration,,,,,3,,,,,,3,,,"Verbal, Somatic, DivineFocus",Close,1 créature de niveau 3 ou 1d3 créatures de niveau 2 ou 1d4+1 créatures de niveau 1 convoquées,1 Round,Appelle une ou plusieurs créatures luttant pour le PJ.,http://www.pathfinder-fr.org/Wiki/Pathfinder-RPG.Convocation dalliés naturels III.ashx,http://paizo.com/pathfinderRPG/prd/spells/summonNatureSAlly#summon-nature-s-ally-iii
summon-nature's-ally-iv,Convocation d'alliés naturels IV,Summon Nature's Ally IV,,None,Conjuration,,,,,4,,,,,,4,,,"Verbal, Somatic, DivineFocus",Close,1 créature de niveau 4 ou 1d3 créatures de niveau 3 ou 1d4+1 créatures de niveau moindre convoquées,1 Round,Appelle une ou plusieurs créatures luttant pour le PJ.,http://www.pathfinder-fr.org/Wiki/Pathfinder-RPG.Convocation dalliés naturels IV.ashx,http://paizo.com/pathfinderRPG/prd/spells/summonNatureSAlly#summon-nature-s-ally-iv
summon-nature's-ally-ix,Convocation d'alliés naturels IX,Summon Nature's Ally IX,,None,Conjuration,,,,,9,,,,,,,,,"Verbal, Somatic, DivineFocus",Close,1 créature de niveau 9 ou 1d3 créatures de niveau 8 ou 1d4+1 créatures de niveau moindre convoquées,1 Round,Appelle une ou plusieurs créatures luttant pour le PJ.,http://www.pathfinder-fr.org/Wiki/Pathfinder-RPG.Convocation dalliés naturels IX.ashx,http://paizo.com/pathfinderRPG/prd/spells/summonNatureSAlly#summon-nature-s-ally-ix
summon-nature's-ally-v,Convocation d'alliés naturels V,Summon Nature's Ally V,,None,Conjuration,,,,,5,,,,,,,,,"Verbal, Somatic, DivineFocus",Close,1 créature de niveau 5 ou 1d3 créatures de niveau 4 ou 1d4+1 créatures de niveau moindre convoquées,1 Round,Appelle une ou plusieurs créatures luttant pour le PJ.,http://www.pathfinder-fr.org/Wiki/Pathfinder-RPG.Convocation dalliés naturels V.ashx,http://paizo.com/pathfinderRPG/prd/spells/summonNatureSAlly#summon-nature-s-ally-v
summon-nature's-ally-vi,Convocation d'alliés naturels VI,Summon Nature's Ally VI,,None,Conjuration,,,,,6,,,,,,,,,"Verbal, Somatic, DivineFocus",Close,1 créature de niveau 6 ou 1d3 créatures de niveau 5 ou 1d4+1 créatures de niveau moindre convoquées,1 Round,Appelle une ou plusieurs créatures luttant pour le PJ.,http://www.pathfinder-fr.org/Wiki/Pathfinder-RPG.Convocation dalliés naturels VI.ashx,http://paizo.com/pathfinderRPG/prd/spells/summonNatureSAlly#summon-nature-s-ally-vi
summon-nature's-ally-vii,Convocation d'alliés naturels VII,Summon Nature's Ally VII,,None,Conjuration,,,,,7,,,,,,,,,"Verbal, Somatic, DivineFocus",Close,1 créature de niveau 7 ou 1d3 créatures de niveau 6 ou 1d4+1 créatures de niveau moindre convoquées,1 Round,Appelle une ou plusieurs créatures luttant pour le PJ.,http://www.pathfinder-fr.org/Wiki/Pathfinder-RPG.Convocation dalliés naturels VII.ashx,http://paizo.com/pathfinderRPG/prd/spells/summonNatureSAlly#summon-nature-s-ally-vii
summon-nature's-ally-viii,Convocation d'alliés naturels VIII,Summon Nature's Ally VIII,,None,Conjuration,,,,,8,,,,,,,,,"Verbal, Somatic, DivineFocus",Close,1 créature de niveau 8 ou 1d3 créatures de niveau 7 ou 1d4+1 créatures de niveau moindre convoquées,1 Round,Appelle une ou plusieurs créatures luttant pour le PJ.,http://www.pathfinder-fr.org/Wiki/Pathfinder-RPG.Convocation dalliés naturels VIII.ashx,http://paizo.com/pathfinderRPG/prd/spells/summonNatureSAlly#summon-nature-s-ally-viii
summon-froghemoth,Convocation de froghémoth,Summon Froghemoth,um,None,Conjuration,,,,,9,,,,,,,,,"Verbal, Somatic",Close,une créature,1 Round,Convoque un froghémoth.,http://www.pathfinder-fr.org/Wiki/Pathfinder-RPG.Convocation de froghémoth.ashx,http://paizo.com/pathfinderRPG/prd/ultimateMagic/spells/summonFroghemoth.html#_summon-froghemoth
summon-minor-monster,Convocation de monstres mineure,Summon Minor Monster,um,None,Conjuration,,1,1,1,,,1,,,,,1,1,"Verbal, Somatic, FocusOrDivineFocus",Close,1d3 créatures invoquées,1 Round,Convoque 1d3 animaux TP.,http://www.pathfinder-fr.org/Wiki/Pathfinder-RPG.Convocation de monstre mineur.ashx,http://paizo.com/pathfinderRPG/prd/ultimateMagic/spells/summonMinorMonster.html#_summon-minor-monster
summon-monster-i,Convocation de monstres I,Summon Monster I,,None,Conjuration,,1,1,1,,,1,,,,,1,1,"Verbal, Somatic, FocusOrDivineFocus",Close,1 créature convoquée,1 Round,Appelle une créature extraplanaire luttant pour le PJ.,http://www.pathfinder-fr.org/Wiki/Pathfinder-RPG.Convocation de monstres I.ashx,http://paizo.com/pathfinderRPG/prd/spells/summonMonster#summon-monster-i
summon-monster-ii,Convocation de monstres II,Summon Monster II,,None,Conjuration,,2,2,2,,,2,,,,,2,2,"Verbal, Somatic, FocusOrDivineFocus",Close,1 créature de niveau 2 ou 1d3 créatures de niveau 1 convoquées,1 Round,Appelle une ou plusieurs créatures extraplanaires luttant pour le PJ.,http://www.pathfinder-fr.org/Wiki/Pathfinder-RPG.Convocation de monstres II.ashx,http://paizo.com/pathfinderRPG/prd/spells/summonMonster#summon-monster-ii
summon-monster-iii,Convocation de monstres III,Summon Monster III,,None,Conjuration,,3,3,3,,,,,,,,3,3,"Verbal, Somatic, FocusOrDivineFocus",Close,1 créature de niveau 3 ou 1d3 créatures de niveau 2 ou 1d4+1 créatures de niveau 1 convoquées,1 Round,Appelle une ou plusieurs créatures extraplanaires luttant pour le PJ.,http://www.pathfinder-fr.org/Wiki/Pathfinder-RPG.Convocation de monstres III.ashx,http://paizo.com/pathfinderRPG/prd/spells/summonMonster#summon-monster-iii
summon-monster-iv,Convocation de monstres IV,Summon Monster IV,,None,Conjuration,,4,4,4,,,3,,,,,4,4,"Verbal, Somatic, FocusOrDivineFocus",Close,1 créature de niveau 4 ou 1d3 créatures de niveau 3 ou 1d4+1 créatures de niveau moindre convoquées,1 Round,Appelle une ou plusieurs créatures extraplanaires luttant pour le PJ.,http://www.pathfinder-fr.org/Wiki/Pathfinder-RPG.Convocation de monstres IV.ashx,http://paizo.com/pathfinderRPG/prd/spells/summonMonster#summon-monster-iv
summon-monster-ix,Convocation de monstres IX,Summon Monster IX,,None,Conjuration,,,,9,,,,,,,,9,9,"Verbal, Somatic, FocusOrDivineFocus",Close,1 créature de niveau 9 ou 1d3 créatures de niveau 8 ou 1d4+1 créatures de niveau moindre convoquées,1 Round,Appelle une ou plusieurs créatures extraplanaires luttant pour le PJ.,http://www.pathfinder-fr.org/Wiki/Pathfinder-RPG.Convocation de monstres IX.ashx,http://paizo.com/pathfinderRPG/prd/spells/summonMonster#summon-monster-ix
summon-monster-v,Convocation de monstres V,Summon Monster V,,None,Conjuration,,,5,5,,,4,,,,,5,5,"Verbal, Somatic, FocusOrDivineFocus",Close,1 créature de niveau 5 ou 1d3 créatures de niveau 4 ou 1d4+1 créatures de niveau moindre convoquées,1 Round,Appelle une ou plusieurs créatures extraplanaires luttant pour le PJ.,http://www.pathfinder-fr.org/Wiki/Pathfinder-RPG.Convocation de monstres V.ashx,http://paizo.com/pathfinderRPG/prd/spells/summonMonster#summon-monster-v
summon-monster-vi,Convocation de monstres VI,Summon Monster VI,,None,Conjuration,,,6,6,,,,,,,,6,6,"Verbal, Somatic, FocusOrDivineFocus",Close,1 créature de niveau 6 ou 1d3 créatures de niveau 5 ou 1d4+1 créatures de niveau moindre convoquées,1 Round,Appelle une ou plusieurs créatures extraplanaires luttant pour le PJ.,http://www.pathfinder-fr.org/Wiki/Pathfinder-RPG.Convocation de monstres VI.ashx,http://paizo.com/pathfinderRPG/prd/spells/summonMonster#summon-monster-vi
summon-monster-vii,Convocation de monstres VII,Summon Monster VII,,None,Conjuration,,,,7,,,5,,,,,7,7,"Verbal, Somatic, FocusOrDivineFocus",Close,1 créature de niveau 7 ou 1d3 créatures de niveau 6 ou 1d4+1 créatures de niveau moindre convoquées,1 Round,Appelle une ou plusieurs créatures extraplanaires luttant pour le PJ.,http://www.pathfinder-fr.org/Wiki/Pathfinder-RPG.Convocation de monstres VII.ashx,http://paizo.com/pathfinderRPG/prd/spells/summonMonster#summon-monster-vii
summon-monster-viii,Convocation de monstres VIII,Summon Monster VIII,,None,Conjuration,,,,8,,,6,,,,,8,8,"Verbal, Somatic, FocusOrDivineFocus",Close,1 créature de niveau 8 ou 1d3 créatures de niveau 7 ou 1d4+1 créatures de niveau moindre convoquées,1 Round,Appelle une ou plusieurs créatures extraplanaires luttant pour le PJ.,http://www.pathfinder-fr.org/Wiki/Pathfinder-RPG.Convocation de monstres VIII.ashx,http://paizo.com/pathfinderRPG/prd/spells/summonMonster#summon-monster-viii
conjure-black-pudding,Convocation de pudding noir,Conjure Black Pudding,um,Acid,Conjuration,,,,,,,5,,,,,,6,"Verbal, Somatic, Material",Close,un pudding noir convoqué,1 Round,Convoque un pudding noir.,http://www.pathfinder-fr.org/Wiki/Pathfinder-RPG.Convocation de pudding noir.ashx,http://paizo.com/pathfinderRPG/prd/ultimateMagic/spells/conjureBlackPudding.html#_conjure-black-pudding
summon-elder-worm,Convocation de ver vénérable,Summon Elder Worm,um,None,Conjuration,,,,,9,,,,,,,,,"Verbal, Somatic",Close,une créature invoquée,1 Round,Convoque un vert pourpre géant.,http://www.pathfinder-fr.org/Wiki/Pathfinder-RPG.Convocation de ver vénérable.ashx,http://paizo.com/pathfinderRPG/prd/ultimateMagic/spells/summonElderWorm.html#_summon-elder-worm
summon-eidolon,Convocation d'eidolon,Summon Eidolon,apg,None,Conjuration,,,,,,,2,,,,,,,"Verbal, Somatic, Material",Close,un eidolon,1 Round,Convoque instantanément l’eidolon du personnage pendant 1 minute/niveau.,http://www.pathfinder-fr.org/Wiki/Pathfinder-RPG.Convocation deidolon.ashx,http://paizo.com/pathfinderRPG/prd/advanced/spells/summonEidolon.html#_summon-eidolon
summon-instrument,Convocation d'instrument,Summon Instrument,,None,Conjuration,,,0,,,,,,,,,,,"Verbal, Somatic",0 Squares,1 instrument portable convoqué,1 Round,Convoque un instrument de musique au choix.,http://www.pathfinder-fr.org/Wiki/Pathfinder-RPG.Convocation dinstrument.ashx,http://paizo.com/pathfinderRPG/prd/spells/summonInstrument#summon-instrument
shadow-conjuration-greater,Convocation d'ombres suprême,"Shadow Conjuration, Greater",,Shadow,Illusion,,,,,,,,,,,,,7,"Verbal, Somatic",voir description,voir description,SimpleAction,"Comme convocation d'ombres, mais jusqu'au 6e niveau ; 60 % sont réelles.",http://www.pathfinder-fr.org/Wiki/Pathfinder-RPG.Convocation dombres suprême.ashx,http://paizo.com/pathfinderRPG/prd/spells/shadowConjuration#shadow-conjuration-greater
shadow-conjuration,Convocation d'ombres,Shadow Conjuration,,Shadow,Illusion,,,4,,,,,,,,,,4,"Verbal, Somatic",voir description,voir description,SimpleAction,Reproduit les invocations de 3e niveau ou moins ; 20 % sont réelles.,http://www.pathfinder-fr.org/Wiki/Pathfinder-RPG.Convocation dombres.ashx,http://paizo.com/pathfinderRPG/prd/spells/shadowConjuration#shadow-conjuration
antiplant-shell,Coquille antiplantes,Antiplant Shell,,None,Abjuration,,,,,4,,,,,,,,,"Verbal, Somatic, DivineFocus",2 Squares,émanation de 3 m (2 c) de rayon centrée sur le jeteur de sorts,SimpleAction,Empêche les plantes animées d'approcher.,http://www.pathfinder-fr.org/Wiki/Pathfinder-RPG.Coquille antiplantes.ashx,http://paizo.com/pathfinderRPG/prd/spells/antiplantShell#antiplant-shell
antilife-shell,Coquille antivie,Antilife Shell,,None,Abjuration,,,,6,6,,,,,,,,,"Verbal, Somatic, DivineFocus",2 Squares,"émanation de 3 m (2 c) de rayon, centrée sur le jeteur de sorts",1 Round,Tient les créatures vivantes à distance (3 m).,http://www.pathfinder-fr.org/Wiki/Pathfinder-RPG.Coquille antivie.ashx,http://paizo.com/pathfinderRPG/prd/spells/antilifeShell#antilife-shell
horn-of-pursuit,Cor de poursuite,Horn of Pursuit,um,Sonic,Evocation,,,1,,,1,,,,1,1,,,Somatic,Personal,3 sonneries de cor,SimpleAction,Crée trois notes entendues à des kilomètres.,http://www.pathfinder-fr.org/Wiki/Pathfinder-RPG.Cor de poursuite.ashx,http://paizo.com/pathfinderRPG/prd/ultimateMagic/spells/hornOfPursuit.html#_horn-of-pursuit
animate-rope,Corde animée,Animate Rope,,None,Transmutation,,,1,,,,,,,,,,1,"Verbal, Somatic",Medium,"1 corde (ou objet assimilé) ne dépassant pas une longueur de 15 m + 1,50 m/niveau (voir description)",SimpleAction,Une corde bouge sur ordre du PJ.,http://www.pathfinder-fr.org/Wiki/Pathfinder-RPG.Corde animée.ashx,http://paizo.com/pathfinderRPG/prd/spells/animateRope#animate-rope
chord-of-shards,Corde d'échardes,Chord of Shards,um,None,Evocation,,,1,,,,,,,,,,,"Verbal, Somatic",3 Squares,cône,SimpleAction,La représentation inflige 2d6 points de dégâts perforants.,http://www.pathfinder-fr.org/Wiki/Pathfinder-RPG.Corde déchardes.ashx,http://paizo.com/pathfinderRPG/prd/ultimateMagic/spells/chordOfShards.html#_chord-of-shards
rope-trick,Corde enchantée,Rope Trick,,None,Transmutation,,,,,,,,,,,,,2,"Verbal, Somatic, Material",Touch,"1 corde faisant entre 1,50 m et 9 m de long",SimpleAction,Huit créatures peuvent se cacher dans un espace extradimensionnel.,http://www.pathfinder-fr.org/Wiki/Pathfinder-RPG.Corde enchantée.ashx,http://paizo.com/pathfinderRPG/prd/spells/ropeTrick#rope-trick
iron-body,Corps de fer,Iron Body,,None,Transmutation,,,,,,,,,,,,,8,"Verbal, Somatic, FocusOrDivineFocus",Personal,le jeteur de sorts,SimpleAction,"Le corps du PJ se transforme en fer vivant. ",http://www.pathfinder-fr.org/Wiki/Pathfinder-RPG.Corps de fer.ashx,http://paizo.com/pathfinderRPG/prd/spells/ironBody#iron-body
ice-body,Corps de glace,Ice Body,um,Cold,Transmutation,,,,,,,,,,,,7,7,"Verbal, Somatic",Personal,lanceur de sorts,SimpleAction,Le corps du personnage devient de la glace vivante.,http://www.pathfinder-fr.org/Wiki/Pathfinder-RPG.Corps de glace.ashx,http://paizo.com/pathfinderRPG/prd/ultimateMagic/spells/iceBody.html#_ice-body
elemental-body-i,Corps élémentaire I,Elemental Body I,,None,Transmutation,4,,,,,,,4,,,,,4,"Verbal, Somatic, Material",Personal,lanceur de sorts,SimpleAction,Le lanceur de sorts se transforme en élémentaire de taille P.,http://www.pathfinder-fr.org/Wiki/Pathfinder-RPG.Corps élémentaire I.ashx,http://paizo.com/pathfinderRPG/prd/spells/elementalBody#elemental-body-i
elemental-body-ii,Corps élémentaire II,Elemental Body II,,None,Transmutation,5,,,,,,,5,,,,,5,"Verbal, Somatic, Material",Personal,lanceur de sorts,SimpleAction,Le lanceur de sorts se transforme en élémentaire de taille M.,http://www.pathfinder-fr.org/Wiki/Pathfinder-RPG.Corps élémentaire II.ashx,http://paizo.com/pathfinderRPG/prd/spells/elementalBody#elemental-body-ii
elemental-body-iii,Corps élémentaire III,Elemental Body III,,None,Transmutation,6,,,,,,,6,,,,,6,"Verbal, Somatic, Material",Personal,lanceur de sorts,SimpleAction,Le lanceur de sorts se transforme en élémentaire de taille G.,http://www.pathfinder-fr.org/Wiki/Pathfinder-RPG.Corps élémentaire III.ashx,http://paizo.com/pathfinderRPG/prd/spells/elementalBody#elemental-body-iii
elemental-body-iv,Corps élémentaire IV,Elemental Body IV,,None,Transmutation,,,,,,,,,,,,,7,"Verbal, Somatic, Material",Personal,lanceur de sorts,SimpleAction,Le lanceur de sorts se transforme en élémentaire de taille TG.,http://www.pathfinder-fr.org/Wiki/Pathfinder-RPG.Corps élémentaire IV.ashx,http://paizo.com/pathfinderRPG/prd/spells/elementalBody#elemental-body-iv
fiery-body,Corps enflammé,Fiery Body,apg,Fire,Transmutation,,,,,,,,,,,,,9,Verbal,Personal,lanceur de sorts,SimpleAction,Le lanceur de sorts se transforme en flamme vivante.,http://www.pathfinder-fr.org/Wiki/Pathfinder-RPG.Corps enflammé.ashx,http://paizo.com/pathfinderRPG/prd/advanced/spells/fieryBody.html#_fiery-body
thorn-body,Corps épineux,Thorn Body,apg,None,Transmutation,3,,,,4,,,,,,,,,"Verbal, Somatic, DivineFocus",Personal,lanceur de sorts,SimpleAction,Ceux qui attaquent le personnage subissent 1d6+1 points de dégâts/niveau.,http://www.pathfinder-fr.org/Wiki/Pathfinder-RPG.Corps épineux.ashx,http://paizo.com/pathfinderRPG/prd/advanced/spells/thornBody.html#_thorn-body
corrosive-consumption,Corrosion,Corrosive Consumption,um,Acid,Conjuration,,,,,,,,5,,,,,5,"Verbal, Somatic",Touch,une créature touchée,SimpleAction,Une tache acide blesse un adversaire.,http://www.pathfinder-fr.org/Wiki/Pathfinder-RPG.Corrosion.ashx,http://paizo.com/pathfinderRPG/prd/ultimateMagic/spells/corrosiveConsumption.html#_corrosive-consumption
color-spray,Couleurs dansantes,Color Spray,,MindAffecting,Illusion,,,,,,,,1,,,,,1,"Verbal, Somatic, Material",3 Squares,rayonnement en forme de cône,SimpleAction,"Assomme, aveugle et/ou étourdit 1d6 créatures.",http://www.pathfinder-fr.org/Wiki/Pathfinder-RPG.Couleurs dansantes.ashx,http://paizo.com/pathfinderRPG/prd/spells/colorSpray#color-spray
true-strike,Coup au but,True Strike,,None,Divination,1,,,,,1,,1,,,,,1,"Verbal, Focus",Personal,le jeteur de sorts,SimpleAction,Confère un bonus de +20 au prochain jet d'attaque.,http://www.pathfinder-fr.org/Wiki/Pathfinder-RPG.Coup au but.ashx,http://paizo.com/pathfinderRPG/prd/spells/trueStrike#true-strike
resounding-blow,Coup retentissant,Resounding Blow,apg,Sonic,Evocation,,4,,,,5,,,,4,,,,Verbal,Personal,lanceur de sorts,SwiftAction,Attaque de corps à corps qui inflige 1d6 points de dégâts sonores supplémentaires.,http://www.pathfinder-fr.org/Wiki/Pathfinder-RPG.Coup retentissant.ashx,http://paizo.com/pathfinderRPG/prd/advanced/spells/resoundingBlow.html#_resounding-blow
thunder-fire,Coup tonitruant,Thunder Fire,uc,None,Transmutation,,,2,,,,,,,,,2,2,"Verbal, Somatic, Focus",Close,1 arme à feu,SimpleAction,Les munitions de l’arme ciblée rendent les adversaires sourds.,http://www.pathfinder-fr.org/Wiki/Pathfinder-RPG.Coup tonitruant.ashx,http://paizo.com/pathfinderRPG/prd/ultimateCombat/spells/thunderFire.html
cup-of-dust,Coupe de poussière,Cup of Dust,apg,Curse,Transmutation,,,,,3,,,,,,,3,,"Verbal, Somatic, Material",Close,une créature,SimpleAction,Déshydrate une créature.,http://www.pathfinder-fr.org/Wiki/Pathfinder-RPG.Coupe de poussière.ashx,http://paizo.com/pathfinderRPG/prd/advanced/spells/cupOfDust.html#_cup-of-dust
wreath-of-blades,Couronne de lames,Wreath of Blades,uc,None,Abjuration,,,,,,,5,4,,,,5,5,"Verbal, Somatic, Focus",Personal,lanceur de sorts,SimpleAction,"Quatre lames de mithral tournoient autour du personnage, attaquent les créatures voisines et le protègent contre les attaques d’opportunité quand il lance un sort.",http://www.pathfinder-fr.org/Wiki/Pathfinder-RPG.Couronne de lames.ashx,http://paizo.com/pathfinderRPG/prd/ultimateCombat/spells/wreathOfBlades.html
order's-wrath,Courroux de l'ordre,Order's Wrath,,Lawful,Evocation,,,,4,,4,,,,,,,,"Verbal, Somatic",Medium,toutes les créatures non-Loyales qui se trouvent dans un cube de 9 m (6 c) de côté,SimpleAction,Blesse et étourdit les créatures Chaotiques (1d8 pts de dégâts/2 niveaux).,http://www.pathfinder-fr.org/Wiki/Pathfinder-RPG.Courroux de lordre.ashx,http://paizo.com/pathfinderRPG/prd/spells/orderSWrath#order-s-wrath
phantom-steed-communal,Coursier fantôme (partagé),"Phantom Steed, Communal",uc,None,Conjuration,,,4,,,,3,,,,,,4,"Verbal, Somatic",Close,jusqu’à six créatures équines quasi-réelles,10 Minute,Comme coursier fantôme mais la durée d’effet se divise entre les créatures touchées.,http://www.pathfinder-fr.org/Wiki/Pathfinder-RPG.Coursier fantôme (partagé).ashx,http://paizo.com/pathfinderRPG/prd/ultimateCombat/spells/phantomSteed.html
phantom-steed,Coursier fantôme,Phantom Steed,,None,Conjuration,,,3,,,,2,3,,,,,3,"Verbal, Somatic",0 Squares,1 équidé quasi réel,10 Minute,Crée un cheval magique pour 1 heure/niveau.,http://www.pathfinder-fr.org/Wiki/Pathfinder-RPG.Coursier fantôme.ashx,http://paizo.com/pathfinderRPG/prd/spells/phantomSteed#phantom-steed
spit-venom,Crachat venimeux,Spit Venom,um,Poison,Transmutation,,,,4,3,,,,,,,3,,Verbal,Close,un jet de venin,SimpleAction,Crache du venin de vipère noire aveuglant.,http://www.pathfinder-fr.org/Wiki/Pathfinder-RPG.Crachat venimeux.ashx,http://paizo.com/pathfinderRPG/prd/ultimateMagic/spells/spitVenom.html#_spit-venom
cackling-skull,Crâne ricanant,Cackling Skull,um,None,Illusion,,,,,,,,,,,,3,,"Verbal, Somatic",Close,un crâne,SimpleAction,"Un crâne agit comme une bouche magique, les auditeurs sont secoués.",http://www.pathfinder-fr.org/Wiki/Pathfinder-RPG.Crâne ricanant.ashx,http://paizo.com/pathfinderRPG/prd/ultimateMagic/spells/cacklingSkull.html#_cackling-skull
create-treasure-map,Création de carte au trésor,Create Treasure Map,apg,None,Divination,,,2,,3,,,,,,2,,2,"Verbal, Somatic, Material",Touch,une créature morte,1 Hour,Crée une carte au trésor à partir du cadavre d’une créature.,http://www.pathfinder-fr.org/Wiki/Pathfinder-RPG.Création de carte au trésor.ashx,http://paizo.com/pathfinderRPG/prd/advanced/spells/createTreasureMap.html#_create-treasure-map
create-demiplane-lesser,Création de demi-plan mineure,"Create Demiplane, Lesser",um,None,Conjuration,,,,7,,,5,,,,,7,7,"Verbal, Somatic, Focus",,"demi-plan extradimensionnel, jusqu’à 3 cubes de 1,50 mètre/niveau (S)",2 Hour,Création d'un demi-plan.,http://www.pathfinder-fr.org/Wiki/Pathfinder-RPG.Création de demi-plan mineure.ashx,"http://paizo.com/pathfinderRPG/prd/ultimateMagic/spells/createDemiplane.html#_create-demiplane,-lesser"
create-demiplane-greater,Création de demi-plan supérieure,"Create Demiplane, Greater",um,None,Conjuration,,,,9,,,,,,,,9,9,"Verbal, Somatic, Focus",,"demi-plan extradimensionnel, jusqu’à 20 cubes de 1,50 mètre/niveau (S)",6 Hour,Comme  création de demi-plan mais plus grand et avec plus de caractéristiques planaires.,http://www.pathfinder-fr.org/Wiki/Pathfinder-RPG.Création de demi-plan supérieure.ashx,"http://paizo.com/pathfinderRPG/prd/ultimateMagic/spells/createDemiplane.html#_create-demiplane,-greater"
create-demiplane,Création de demi-plan,Create Demiplane,um,None,Conjuration,,,,8,,,6,,,,,8,8,,,,4 Hour,Comme création de demi-plan mineure mais plus grand et avec des caractéristiques planaires.,http://www.pathfinder-fr.org/Wiki/Pathfinder-RPG.Création de demi-plan.ashx,http://paizo.com/pathfinderRPG/prd/ultimateMagic/spells/createDemiplane.html#_create-demiplane
