Id,Name,English,Source,Descriptor,School,Alchemist,AntiPaladin,Bard,Cleric,Druid,Inquisitor,Summoner,Magus,Oracle,Paladin,Ranger,Witch,Wizard,Components,Range,Target,CastingTime,Summary,FrUrl,EnUrl
protection-from-good-communal,Protection contre le Bien (partagé),"Protection from Good, Communal",uc,Evil,Abjuration,,2,,2,,2,2,,,2,,,2,"Verbal, Somatic, FocusOrDivineFocus",Touch,créatures touchées,SimpleAction,Comme protection contre le Bien mais la durée d’effet se divise entre les créatures touchées.,http://www.pathfinder-fr.org/Wiki/Pathfinder-RPG.Protection contre le Bien (partagé).ashx,http://paizo.com/pathfinderRPG/prd/ultimateCombat/spells/protectionFromGood.html
protection-from-good,Protection contre le Bien,Protection From Good,,Evil,Abjuration,,1,,1,,1,1,,,,,,1,"Verbal, Somatic, FocusOrDivineFocus",Touch,créature touchée,SimpleAction,"+2 à la CA et aux jets de sauvegarde, protection supplémentaire contre l'alignement choisi.",http://www.pathfinder-fr.org/Wiki/Pathfinder-RPG.Protection contre le Bien.ashx,http://paizo.com/pathfinderRPG/prd/spells/protectionFromGood#protection-from-good
protection-from-chaos-communal,Protection contre le Chaos (partagé),"Protection from Chaos, Communal",uc,Lawful,Abjuration,,,,2,,2,2,,,2,,,2,"Verbal, Somatic, FocusOrDivineFocus",Touch,créatures touchées,SimpleAction,Comme  protection contre le Chaos mais la durée d’effet se divise entre les créatures touchées.,http://www.pathfinder-fr.org/Wiki/Pathfinder-RPG.Protection contre le Chaos (partagé).ashx,http://paizo.com/pathfinderRPG/prd/ultimateCombat/spells/protectionFromChaos.html
protection-from-chaos,Protection contre le Chaos,Protection From Chaos,,Lawful,Abjuration,,,,1,,1,1,,,1,,,1,"Verbal, Somatic, FocusOrDivineFocus",Touch,créature touchée,SimpleAction,"+2 à la CA et aux jets de sauvegarde, protection supplémentaire contre l'alignement choisi.",http://www.pathfinder-fr.org/Wiki/Pathfinder-RPG.Protection contre le Chaos.ashx,http://paizo.com/pathfinderRPG/prd/spells/protectionFromChaos#protection-from-chaos
protection-from-evil-communal,Protection contre le Mal (partagé),"Protection from Evil, Communal",uc,Good,Abjuration,,,,2,,2,2,,,2,,,2,"Verbal, Somatic, FocusOrDivineFocus",Touch,créatures touchées,SimpleAction,Comme protection contre le Mal mais la durée d’effet se divise entre les créatures touchées.,http://www.pathfinder-fr.org/Wiki/Pathfinder-RPG.Protection contre le Mal (partagé).ashx,http://paizo.com/pathfinderRPG/prd/ultimateCombat/spells/protectionFromEvil.html
protection-from-evil,Protection contre le Mal,Protection From Evil,,Good,Abjuration,,,,1,,1,1,,,1,,,1,"Verbal, Somatic, FocusOrDivineFocus",Touch,créature touchée,SimpleAction,"+2 à la CA et aux jets de sauvegarde, protection supplémentaire contre l'alignement choisi.",http://www.pathfinder-fr.org/Wiki/Pathfinder-RPG.Protection contre le Mal.ashx,http://paizo.com/pathfinderRPG/prd/spells/protectionFromEvil#protection-from-evil
protection-from-energy-communal,Protection contre les énergies destructives (partagé),"Protection from Energy, Communal",uc,None,Abjuration,,,,4,4,4,4,,,,3,,4,"Verbal, Somatic, DivineFocus",Touch,créatures touchées,SimpleAction,Comme protection contre les énergies destructives mais la durée d’effet se divise entre les créatures touchées.,http://www.pathfinder-fr.org/Wiki/Pathfinder-RPG.Protection contre les énergies destructives (partagé).ashx,http://paizo.com/pathfinderRPG/prd/ultimateCombat/spells/protectionFromEnergy.html
protection-from-energy,Protection contre les énergies destructives,Protection From Energy,,None,Abjuration,3,,,3,3,3,3,,,,2,,3,"Verbal, Somatic, DivineFocus",Touch,créature touchée,SimpleAction,Absorbe 12 points de dégâts/niveau infligés par le type d'énergie choisi.,http://www.pathfinder-fr.org/Wiki/Pathfinder-RPG.Protection contre les énergies destructives.ashx,http://paizo.com/pathfinderRPG/prd/spells/protectionFromEnergy#protection-from-energy
protection-from-arrows-communal,Protection contre les projectiles (partagé),"Protection from Arrows, Communal",uc,None,Abjuration,3,,,,,,3,,,,,,3,"Verbal, Somatic, Focus",Touch,créatures touchées,SimpleAction,Comme  protection contre les projectiles mais la durée d’effet se divise entre les créatures touchées.,http://www.pathfinder-fr.org/Wiki/Pathfinder-RPG.Protection contre les projectiles (partagé).ashx,http://paizo.com/pathfinderRPG/prd/ultimateCombat/spells/protectionFromArrows.html
protection-from-arrows,Protection contre les projectiles,Protection From Arrows,,None,Abjuration,2,,,,,,2,,,,,,2,"Verbal, Somatic, Focus",Touch,créature touchée,SimpleAction,La cible gagne RD 10/magie contre les attaques à distance.,http://www.pathfinder-fr.org/Wiki/Pathfinder-RPG.Protection contre les projectiles.ashx,http://paizo.com/pathfinderRPG/prd/spells/protectionFromArrows#protection-from-arrows
protection-from-spells,Protection contre les sorts,Protection From Spells,,None,Abjuration,,,,,,,6,,,,,,8,"Verbal, Somatic, Material",Touch,jusqu’à 1 créature touchée/4 niveaux,SimpleAction,Confère un bonus de résistance de +8.,http://www.pathfinder-fr.org/Wiki/Pathfinder-RPG.Protection contre les sorts.ashx,http://paizo.com/pathfinderRPG/prd/spells/protectionFromSpells#protection-from-spells
shield-other,Protection d'autrui,Shield Other,,None,Abjuration,,,,2,,2,,,,2,,,,"Verbal, Somatic, Focus",Close,1 créature,SimpleAction,Le PJ subit 1/2 dégâts à la place du sujet.,http://www.pathfinder-fr.org/Wiki/Pathfinder-RPG.Protection dautrui.ashx,http://paizo.com/pathfinderRPG/prd/spells/shieldOther#shield-other
ward-the-faithful,Protection des fidèles,Ward the Faithful,apg,None,Abjuration,,,,,,3,,,,,,,,"Verbal, Somatic, DivineFocus",Touch,émanation de 3 m (2 c) de rayon issue de la créature touchée,SimpleAction,Les créatures du même alignement que la cible gagnent des bonus à la CA et aux jets de sauvegarde.,http://www.pathfinder-fr.org/Wiki/Pathfinder-RPG.Protection des fidèles.ashx,http://paizo.com/pathfinderRPG/prd/advanced/spells/wardTheFaithful.html#_ward-the-faithful
divine-power,Puissance divine,Divine Power,,None,Evocation,,,,4,,4,,,,,,,,"Verbal, Somatic, DivineFocus",Personal,le jeteur de sorts,SimpleAction,Bonus à l'attaque et +1 pv/niveau.,http://www.pathfinder-fr.org/Wiki/Pathfinder-RPG.Puissance divine.ashx,http://paizo.com/pathfinderRPG/prd/spells/divinePower#divine-power
strong-jaw,Puissantes mâchoires,Strong Jaw,apg,None,Transmutation,,,,,4,,,,,,3,,,"Verbal, Somatic",Touch,créature touchée,SimpleAction,Les attaques naturelles infligent les mêmes dégâts que si elles étaient de deux tailles au-dessus.,http://www.pathfinder-fr.org/Wiki/Pathfinder-RPG.Puissantes mâchoires.ashx,http://paizo.com/pathfinderRPG/prd/advanced/spells/strongJaw.html#_strong-jaw
envious-urge,Pulsion de jalousie,Envious Urge,um,None,Enchantment,,,4,,,,,,,,,,6,"Verbal, Somatic",Medium,"une créature/niveau, toutes situées à moins de 9 m les unes des autres",SimpleAction,La cible vole ou désarme autrui.,http://www.pathfinder-fr.org/Wiki/Pathfinder-RPG.Pulsion de jalousie.ashx,http://paizo.com/pathfinderRPG/prd/ultimateMagic/spells/enviousUrge.html#_envious-urge
unadulterated-loathing,Pur dégoût,Unadulterated Loathing,um,None,Enchantment,,2,2,,,,,,,,,3,3,"Verbal, Somatic, Material",Close,une créature,SimpleAction,La cible est obligée d'éviter une créature.,http://www.pathfinder-fr.org/Wiki/Pathfinder-RPG.Pur dégoût.ashx,http://paizo.com/pathfinderRPG/prd/ultimateMagic/spells/unadulteratedLoathing.html#_unadulterated-loathing
purify-food-and-drink,Purification de nourriture et d'eau,Purify Food And Drink,,None,Transmutation,,,,0,0,,,,,,,,,"Verbal, Somatic",2 Squares,30 dm³/niveau d’eau et de nourriture impropres à la consommation,SimpleAction,Purifie 30 dm³/niveau de nourriture et d'eau.,http://www.pathfinder-fr.org/Wiki/Pathfinder-RPG.Purification de nourriture et deau.ashx,http://paizo.com/pathfinderRPG/prd/spells/purifyFoodAndDrink#purify-food-and-drink
cleanse,Purification,Cleanse,apg,None,Evocation,,,,5,,6,,,,,,,,"Somatic, DivineFocus",Personal,lanceur de sorts,SimpleAction,Soigne 4d8 points de dégâts +1/niveau (max +25) et dissipe plusieurs afflictions.,http://www.pathfinder-fr.org/Wiki/Pathfinder-RPG.Purification.ashx,http://paizo.com/pathfinderRPG/prd/advanced/spells/cleanse.html#_cleanse
fester-mass,Purulence de groupe,"Fester, Mass",apg,None,Necromancy,,,,,,6,,,,,,6,,"Verbal, Somatic, Material",Close,"une créature/niveau, qui doivent se trouver à moins de 9 m (6 c) les unes des autres",SimpleAction,Comme purulence mais affecte plusieurs cibles.,http://www.pathfinder-fr.org/Wiki/Pathfinder-RPG.Purulence de groupe.ashx,"http://paizo.com/pathfinderRPG/prd/advanced/spells/fester.html#_fester,-mass"
fester,Purulence,Fester,apg,None,Necromancy,,,,,,3,,,,,,2,,"Verbal, Somatic, Material",Close,une créature vivante,SimpleAction,Donne au sujet une RM 12 + niveau du personnage contre les effets de soins.,http://www.pathfinder-fr.org/Wiki/Pathfinder-RPG.Purulence.ashx,http://paizo.com/pathfinderRPG/prd/advanced/spells/fester.html#_fester
putrefy-food-and-drink,Putréfaction de l'eau et de la nourriture,Putrefy Food and Drink,apg,Poison,Transmutation,,,,,,,,,,,,0,,"Verbal, Somatic",2 Squares,30 litres/niveau d'eau et de nourriture ou une potion ; voir texte,SimpleAction,Rend l’eau et la nourriture immangeables.,http://www.pathfinder-fr.org/Wiki/Pathfinder-RPG.Putréfaction de leau et de la nourriture.ashx,http://paizo.com/pathfinderRPG/prd/advanced/spells/putrefyFoodAndDrink.html#_putrefy-food-and-drink
pyrotechnics,Pyrotechnie,Pyrotechnics,,None,Transmutation,,,2,,,,,2,,,,,2,"Verbal, Somatic, Material",Long,1 source de feu (cube de 6 m d’arête maximum),SimpleAction,Transforme un feu en fumée étouffante ou en lumière aveuglante.,http://www.pathfinder-fr.org/Wiki/Pathfinder-RPG.Pyrotechnie.ashx,http://paizo.com/pathfinderRPG/prd/spells/pyrotechnics#pyrotechnics
geas/quest,Quête,Geas/Quest,,"LanguageDependent, MindAffecting, Curse",Enchantment,,,6,6,,5,,,,,,6,6,Verbal,Close,1 créature vivante,10 Minute,"Comme mission, mais affecte n'importe quelle créature.",http://www.pathfinder-fr.org/Wiki/Pathfinder-RPG.Quête.ashx,http://paizo.com/pathfinderRPG/prd/spells/geasQuest#geasquest
diminish-plants,Rabougrissement des plantes,Diminish Plants,,None,Transmutation,,,,,3,,,,,,3,,,"Verbal, Somatic, DivineFocus",voir description,voir description,SimpleAction,Réduit la taille des plantes ou empêche leur croissance.,http://www.pathfinder-fr.org/Wiki/Pathfinder-RPG.Rabougrissement des plantes.ashx,http://paizo.com/pathfinderRPG/prd/spells/diminishPlants#diminish-plants
root,Racine,Root,paizoBlog,Earth,Transmutation,,,,,,,,,,,,,0,"Verbal, Somatic, Material",Touch,créature touchée,SimpleAction,,http://www.pathfinder-fr.org/Wiki/Pathfinder-RPG.Racine.ashx,http://paizo.com/pathfinderRPG/prd/spells/root.html#_root
rage,Rage,Rage,,"MindAffecting, Emotion",Enchantment,3,,2,,,,3,,,,,3,3,"Verbal, Somatic",Medium,"1 créature vivante et consentante/3 niveaux, distantes de moins de 9 m (6 c) les unes des autres",SimpleAction,"Confère +2 en For et en Con, +1 aux jets de Vol, -2 à la CA.",http://www.pathfinder-fr.org/Wiki/Pathfinder-RPG.Rage.ashx,http://paizo.com/pathfinderRPG/prd/spells/rage#rage
delay-poison-communal,Ralentissement du poison (partagé),"Delay Poison, Communal",uc,Healing,Conjuration,3,,3,3,3,3,,,,3,3,3,,"Verbal, Somatic, DivineFocus",Touch,créatures touchées,SimpleAction,Comme ralentissement du poison mais la durée d’effet se divise entre les créatures touchées.,http://www.pathfinder-fr.org/Wiki/Pathfinder-RPG.Ralentissement du poison (partagé).ashx,http://paizo.com/pathfinderRPG/prd/ultimateCombat/spells/delayPoison.html
delay-poison,Ralentissement du poison,Delay Poison,,Healing,Conjuration,2,,2,2,2,2,,,,2,1,2,,"Verbal, Somatic, DivineFocus",Touch,créature touchée,SimpleAction,Neutralise le poison pendant 1 heure/niveau.,http://www.pathfinder-fr.org/Wiki/Pathfinder-RPG.Ralentissement du poison.ashx,http://paizo.com/pathfinderRPG/prd/spells/delayPoison#delay-poison
soften-earth-and-stone,Ramollissement de la terre et de la pierre,Soften Earth And Stone,,Earth,Transmutation,,,,,2,,,,,,,,,"Verbal, Somatic, DivineFocus",Close,1 carré de 3 m de côté/niveau (voir description),SimpleAction,Transforme la pierre en argile et la terre en sable ou en boue.,http://www.pathfinder-fr.org/Wiki/Pathfinder-RPG.Ramollissement de la terre et de la pierre.ashx,http://paizo.com/pathfinderRPG/prd/spells/softenEarthAndStone#soften-earth-and-stone
spite,Rancune,Spite,apg,None,Abjuration,,,,,,,,,,,,4,,"Verbal, Somatic, Material",Personal,lanceur de sorts,1 Round,Inflige un sort de contact sur la créature qui attaque le personnage.,http://www.pathfinder-fr.org/Wiki/Pathfinder-RPG.Rancune.ashx,http://paizo.com/pathfinderRPG/prd/advanced/spells/spite.html#_spite
reduce-animal,Rapetissement d'animal,Reduce Animal,,None,Transmutation,,,,,2,,,,,,3,,,"Verbal, Somatic",Touch,"1 animal consentant de taille P, M, G ou TG",SimpleAction,Réduit la taille d'un animal consentant.,http://www.pathfinder-fr.org/Wiki/Pathfinder-RPG.Rapetissement danimal.ashx,http://paizo.com/pathfinderRPG/prd/spells/reduceAnimal#reduce-animal
reduce-person-mass,Rapetissement de groupe,"Reduce Person, Mass",,None,Transmutation,,,,,,,3,,,,,,4,"Verbal, Somatic, Material",Close,"1 humanoïde/niveau, distants de moins de 9 m les uns des autres",1 Round,Réduit la taille de plusieurs créatures.,http://www.pathfinder-fr.org/Wiki/Pathfinder-RPG.Rapetissement de groupe.ashx,http://paizo.com/pathfinderRPG/prd/spells/reducePerson#reduce-person-mass
reduce-person,Rapetissement,Reduce Person,,None,Transmutation,1,,,,,,1,1,,,,1,1,"Verbal, Somatic, Material",Close,"1 créature ou 1 objet faisant jusqu’à 0,3 m³/niveau",1 Round,Réduit la taille d'un humanoïde de moitié.,http://www.pathfinder-fr.org/Wiki/Pathfinder-RPG.Rapetissement.ashx,http://paizo.com/pathfinderRPG/prd/spells/reducePerson#reduce-person
haste,Rapidité,Haste,,None,Transmutation,3,,3,,,,2,3,,,,,3,"Verbal, Somatic, Material",Close,"1 créature/niveau, distantes de moins de 9 m les unes des autres",SimpleAction,"Une créature/niveau se déplace plus rapidement, +1 aux jets d'attaque, à la CA et aux jets de Réflexes.",http://www.pathfinder-fr.org/Wiki/Pathfinder-RPG.Rapidité.ashx,http://paizo.com/pathfinderRPG/prd/spells/haste#haste
raise-dead,Rappel à la vie,Raise Dead,,Healing,Conjuration,,,,5,,,,,,,,6,,"Verbal, Somatic, Material",Touch,créature morte touchée,1 Minute,Ressuscite quelqu'un mort depuis 1 jour/niveau max.,http://www.pathfinder-fr.org/Wiki/Pathfinder-RPG.Rappel à la vie.ashx,http://paizo.com/pathfinderRPG/prd/spells/raiseDead#raise-dead
raise-animal-companion,Rappel de compagnon animal,Raise Animal Companion,um,None,Conjuration,,,,,5,,,,,4,4,,,"Verbal, Somatic, Material",Touch,un compagnon animal ou une monture lié mort,1 Minute,Comme  rappel à la vie mais pour un compagnon animal.,http://www.pathfinder-fr.org/Wiki/Pathfinder-RPG.Rappel de compagnon animal.ashx,http://paizo.com/pathfinderRPG/prd/ultimateMagic/spells/raiseAnimalCompanion.html#_raise-animal-companion
status,Rapport,Status,,None,Divination,,,,2,,,,,,,,2,,"Verbal, Somatic",Touch,1 créature vivante touchée/3 niveaux,SimpleAction,Indique où se trouvent les alliés et quel est leur état.,http://www.pathfinder-fr.org/Wiki/Pathfinder-RPG.Rapport.ashx,http://paizo.com/pathfinderRPG/prd/spells/status#status
ray-of-enfeeblement,Rayon affaiblissant,Ray Of Enfeeblement,,None,Necromancy,,,,,,,,1,,,,1,1,"Verbal, Somatic",Close,rayon,SimpleAction,"La cible perd 1d6 points de For, +1/2 niveaux.",http://www.pathfinder-fr.org/Wiki/Pathfinder-RPG.Rayon affaiblissant.ashx,http://paizo.com/pathfinderRPG/prd/spells/rayOfEnfeeblement#ray-of-enfeeblement
scorching-ray,Rayon ardent,Scorching Ray,,Fire,Evocation,,,,,,,,2,,,,,2,"Verbal, Somatic",Close,un ou plusieurs rayons,SimpleAction,"Attaque à distance infligeant 4d6 points de dégâts de feu, +1 rayon/4 niveaux (max. 3).",http://www.pathfinder-fr.org/Wiki/Pathfinder-RPG.Rayon ardent.ashx,http://paizo.com/pathfinderRPG/prd/spells/scorchingRay#scorching-ray
ray-of-sickening,Rayon de fièvre,Ray of Sickening,um,None,Necromancy,,,,1,1,,1,,,,,1,1,"Verbal, Somatic, Material",Close,rayon,SimpleAction,Le rayon rend la cible fiévreuse.,http://www.pathfinder-fr.org/Wiki/Pathfinder-RPG.Rayon de fièvre.ashx,http://paizo.com/pathfinderRPG/prd/ultimateMagic/spells/rayOfSickening.html#_ray-of-sickening
ray-of-frost,Rayon de givre,Ray Of Frost,,Cold,Evocation,,,,,,,,0,,,,,0,"Verbal, Somatic",Close,rayon,SimpleAction,Rayon infligeant 1d3 points de dégâts.,http://www.pathfinder-fr.org/Wiki/Pathfinder-RPG.Rayon de givre.ashx,http://paizo.com/pathfinderRPG/prd/spells/rayOfFrost#ray-of-frost
sunbeam,Rayon de soleil,Sunbeam,,Light,Evocation,,,,,7,,,,,,,,,"Verbal, Somatic, DivineFocus",12 Squares,ligne partant du jeteur de sorts,SimpleAction,Aveugle et inflige 4d6 points de dégâts.,http://www.pathfinder-fr.org/Wiki/Pathfinder-RPG.Rayon de soleil.ashx,http://paizo.com/pathfinderRPG/prd/spells/sunbeam#sunbeam
ray-of-exhaustion,Rayon d'épuisement,Ray Of Exhaustion,,None,Necromancy,,,,,,,,3,,,,3,3,"Verbal, Somatic, Material",Close,rayon,SimpleAction,Un rayon épuise la cible.,http://www.pathfinder-fr.org/Wiki/Pathfinder-RPG.Rayon dépuisement.ashx,http://paizo.com/pathfinderRPG/prd/spells/rayOfExhaustion#ray-of-exhaustion
polar-ray,Rayon polaire,Polar Ray,,Cold,Evocation,,,,,,,,,,,,,8,"Verbal, Somatic, Focus",Medium,rayon,SimpleAction,Attaque de contact à distance infligeant 1d6 points de dégâts de froid/niveau et 1d4 point de réduction permanente de Dextérité.,http://www.pathfinder-fr.org/Wiki/Pathfinder-RPG.Rayon polaire.ashx,http://paizo.com/pathfinderRPG/prd/spells/polarRay#polar-ray
prismatic-spray,Rayons prismatiques,Prismatic Spray,,None,Evocation,,,,,,,,,,,,,7,"Verbal, Somatic",12 Squares,rayonnement en forme de cône,SimpleAction,Rayons magiques à effets variés.,http://www.pathfinder-fr.org/Wiki/Pathfinder-RPG.Rayons prismatiques.ashx,http://paizo.com/pathfinderRPG/prd/spells/prismaticSpray#prismatic-spray
negative-reaction,Réaction négative,Negative Reaction,uc,None,Illusion,,,1,,,,,1,,,,1,1,Somatic,Close,une créature,SimpleAction,La créature ciblée ne peut pas influencer positivement autrui.,http://www.pathfinder-fr.org/Wiki/Pathfinder-RPG.Réaction négative.ashx,http://paizo.com/pathfinderRPG/prd/ultimateCombat/spells/negativeReaction.html
oracle's-vessel,Réceptacle de l'oracle,Oracle's Vessel,um,None,Transmutation,,,,4,,,,,,,,,,"Verbal, Somatic",Close,une créature,SimpleAction,(Oracles seulement) La cible bénéficie des avantages de la malédiction de l'oracle.,http://www.pathfinder-fr.org/Wiki/Pathfinder-RPG.Réceptacle de loracle.ashx,http://paizo.com/pathfinderRPG/prd/ultimateMagic/spells/oraclesVessel.html#_oracle-s-vessel
divine-vessel,Réceptacle divin,Divine Vessel,apg,"Chaotic, Evil, Good, Lawful",Transmutation,,,,8,,,,,,,,,,"Verbal, Somatic",Personal,lanceur de sorts,SimpleAction,Transforme l'oracle en une énorme créature d'un autre monde.,http://www.pathfinder-fr.org/Wiki/Pathfinder-RPG.Réceptacle divin.ashx,http://paizo.com/pathfinderRPG/prd/advanced/spells/divineVessel.html#_divine-vessel
seek-thoughts,Recherche de pensées,Seek Thoughts,apg,MindAffecting,Divination,3,,3,,,3,3,,,,,3,3,"Verbal, Somatic, Material",8 Squares,émanation de 12 m (8 c) de rayon centrée sur le lanceur de sorts,SimpleAction,Détecte les pensées des créatures intelligentes.,http://www.pathfinder-fr.org/Wiki/Pathfinder-RPG.Recherche de pensées.ashx,http://paizo.com/pathfinderRPG/prd/advanced/spells/seekThoughts.html#_seek-thoughts
recoil-fire,Recul excessif,Recoil Fire,uc,None,Transmutation,,,,,,,,,,,,2,2,"Verbal, Somatic, Focus",Close,1 arme à feu,SimpleAction,Les tirs de l’arme à feu ciblée génèrent un recul excessif.,http://www.pathfinder-fr.org/Wiki/Pathfinder-RPG.Recul excessif.ashx,http://paizo.com/pathfinderRPG/prd/ultimateCombat/spells/recoilFire.html
shrink-item,Réduction d'objet,Shrink Item,,None,Transmutation,,,,,,,,,,,,,3,"Verbal, Somatic",Touch,1 objet touché allant jusqu’à 60 dm³/niveau,SimpleAction,Réduit un objet (1/16e de sa taille initiale).,http://www.pathfinder-fr.org/Wiki/Pathfinder-RPG.Réduction dobjet.ashx,http://paizo.com/pathfinderRPG/prd/spells/shrinkItem#shrink-item
shades,Reflets d'ombre,Shades,,Shadow,Illusion,,,,,,,,,,,,,9,"Verbal, Somatic",voir description,voir description,SimpleAction,"Comme convocation d'ombres, mais jusqu'au 8e niveau ; 80 % sont réelles.",http://www.pathfinder-fr.org/Wiki/Pathfinder-RPG.Reflets dombre.ashx,http://paizo.com/pathfinderRPG/prd/spells/shades#shades
secure-shelter,Refuge du mage,Secure Shelter,,None,Conjuration,,,4,,,,,,,,,4,4,"Verbal, Somatic, Material",Close,structure de 6 m de côté,10 Minute,Crée une solide maisonnette.,http://www.pathfinder-fr.org/Wiki/Pathfinder-RPG.Refuge du mage.ashx,http://paizo.com/pathfinderRPG/prd/spells/secureShelter#secure-shelter
refuge,Refuge,Refuge,,Teleportation,Conjuration,,,,7,,,,,,,,9,9,"Verbal, Somatic, Material",Touch,objet touché,SimpleAction,Enchante un objet pour ramener son possesseur jusqu'au PJ.,http://www.pathfinder-fr.org/Wiki/Pathfinder-RPG.Refuge.ashx,http://paizo.com/pathfinderRPG/prd/spells/refuge#refuge
remove-fear,Regain d'assurance,Remove Fear,,None,Abjuration,,,1,1,,1,,,,,,,,"Verbal, Somatic",Close,"1 créature plus 1 autre/4 niveaux, distantes de moins de 9 m les unes des autres",SimpleAction,"+4 aux jets de sauvegarde contre la terreur (un sujet, +1/4 niveaux).",http://www.pathfinder-fr.org/Wiki/Pathfinder-RPG.Regain dassurance.ashx,http://paizo.com/pathfinderRPG/prd/spells/removeFear#remove-fear
burning-gaze,Regard brûlant,Burning Gaze,apg,Fire,Evocation,,,,,2,,,2,,,,2,2,"Verbal, Somatic, FocusOrDivineFocus",Personal,lanceur de sorts,SimpleAction,Inflige 1d6 points de dégâts de feu à une créature.,http://www.pathfinder-fr.org/Wiki/Pathfinder-RPG.Regard brûlant.ashx,http://paizo.com/pathfinderRPG/prd/advanced/spells/burningGaze.html#_burning-gaze
rejuvenate-eidolon-lesser,Régénération d'eidolon mineure,"Rejuvenate Eidolon, Lesser",apg,None,Conjuration,,,,,,,1,,,,,,,"Verbal, Somatic, Material",Touch,eidolon touché,SimpleAction,L'eidolon guérit de 1d10 points de dégâts +1/niveau (max +5).,http://www.pathfinder-fr.org/Wiki/Pathfinder-RPG.Régénération deidolon mineure.ashx,"http://paizo.com/pathfinderRPG/prd/advanced/spells/rejuvenateEidolon.html#_rejuvenate-eidolon,-lesser"
rejuvenate-eidolon-greater,Régénération d'eidolon supérieure,"Rejuvenate Eidolon, Greater",apg,None,Conjuration,,,,,,,5,,,,,,,"Verbal, Somatic, Material",Touch,eidolon touché,SimpleAction,Comme régénération d'eidolon mineure mais guérit de 5d10 points de dégâts +1/niveau (max +20).,http://www.pathfinder-fr.org/Wiki/Pathfinder-RPG.Régénération deidolon supérieure.ashx,"http://paizo.com/pathfinderRPG/prd/advanced/spells/rejuvenateEidolon.html#_rejuvenate-eidolon,-greater"
rejuvenate-eidolon,Régénération d'eidolon,Rejuvenate Eidolon,apg,None,Conjuration,,,,,,,3,,,,,,,"Verbal, Somatic, Material",Touch,eidolon touché,SimpleAction,Comme régénération d'eidolon mineure mais guérit de 3d10 points de dégâts +1/niveau (max +10).,http://www.pathfinder-fr.org/Wiki/Pathfinder-RPG.Régénération deidolon.ashx,http://paizo.com/pathfinderRPG/prd/advanced/spells/rejuvenateEidolon.html#_rejuvenate-eidolon
regenerate,Régénération,Regenerate,,Healing,Conjuration,,,,7,9,,,,,,,7,,"Verbal, Somatic, DivineFocus",Touch,créature vivante touchée,3 rounds entiers,"Fait repousser les membres tranchés, rend 4d8 points de vie, +1/niveau (max. +35).",http://www.pathfinder-fr.org/Wiki/Pathfinder-RPG.Régénération.ashx,http://paizo.com/pathfinderRPG/prd/spells/regenerate#regenerate
devolution,Régression,Devolution,apg,None,Transmutation,,,,,,,3,,,,,,3,"Verbal, Somatic, Material",Close,un eidolon,SimpleAction,L'eidolon visé perd temporairement 1 évolution +1/cinq niveaux.,http://www.pathfinder-fr.org/Wiki/Pathfinder-RPG.Régression.ashx,http://paizo.com/pathfinderRPG/prd/advanced/spells/devolution.html#_devolution
reincarnate,Réincarnation,Reincarnate,,None,Transmutation,,,,,4,,,,,,,5,,"Verbal, Somatic, Material, DivineFocus",Touch,créature morte touchée,10 Minute,"Ramène le sujet à la vie, mais dans un autre corps.",http://www.pathfinder-fr.org/Wiki/Pathfinder-RPG.Réincarnation.ashx,http://paizo.com/pathfinderRPG/prd/spells/reincarnate#reincarnate
dispel-law,Rejet de la Loi,Dispel Law,,Chaotic,Abjuration,,4,,5,,5,,,,,,,,"Verbal, Somatic, DivineFocus",Touch,"le jeteur de sorts et 1 créature extraplanaire loyale, ou le jeteur et le sort du Loi ou l’enchantement affectant la créature ou l’objet touché",SimpleAction,Bonus de +4 contre les attaques.,http://www.pathfinder-fr.org/Wiki/Pathfinder-RPG.Rejet de la Loi.ashx,http://paizo.com/pathfinderRPG/prd/spells/dispelLaw#dispel-law
dispel-good,Rejet du Bien,Dispel Good,,Evil,Abjuration,,4,,5,,5,,,,,,,,"Verbal, Somatic, DivineFocus",Touch,"le jeteur de sorts et 1 créature extraplanaire bonne, ou le jeteur et le sort du Bien ou l’enchantement affectant la créature ou l’objet touché",SimpleAction,Bonus de +4 contre les attaques.,http://www.pathfinder-fr.org/Wiki/Pathfinder-RPG.Rejet du Bien.ashx,http://paizo.com/pathfinderRPG/prd/spells/dispelGood#dispel-good
dispel-chaos,Rejet du Chaos,Dispel Chaos,,Lawful,Abjuration,,,,5,,5,,,,4,,,,"Verbal, Somatic, DivineFocus",Touch,"le jeteur de sorts et 1 créature extraplanaire chaotique, ou le jeteur et le sort du Chaos ou l’enchantement affectant la créature ou l’objet touché",SimpleAction,Bonus de +4 contre les attaques.,http://www.pathfinder-fr.org/Wiki/Pathfinder-RPG.Rejet du Chaos.ashx,http://paizo.com/pathfinderRPG/prd/spells/dispelChaos#dispel-chaos
