Id,Name,English,Source,Descriptor,School,Alchemist,AntiPaladin,Bard,Cleric,Druid,Inquisitor,Summoner,Magus,Oracle,Paladin,Ranger,Witch,Wizard,Components,Range,Target,CastingTime,Summary,FrUrl,EnUrl
howling-agony,Hurlement d'agonie,Howling Agony,um,"Death, Pain",Necromancy,,,,,,2,,,,,,3,3,"Verbal, Somatic, Material",Close,une créature vivante/niveau qui ne doivent pas être distantes de plus de 9 m (6 c) les unes des autres,SimpleAction,Une douleur à hurler limite les actions de la cible.,http://www.pathfinder-fr.org/Wiki/Pathfinder-RPG.Hurlement dagonie.ashx,http://paizo.com/pathfinderRPG/prd/ultimateMagic/spells/howlingAgony.html#_howling-agony
hunter's-howl,Hurlement du chasseur,Hunter's Howl,apg,None,Necromancy,,,,,,,,,,,1,,,"Verbal, Somatic",4 Squares,émanation de 6 m (4 c) de rayon,SimpleAction,Le personnage considère ses adversaires comme des ennemis jurés pendant 1 round/niveau.,http://www.pathfinder-fr.org/Wiki/Pathfinder-RPG.Hurlement du chasseur.ashx,http://paizo.com/pathfinderRPG/prd/advanced/spells/huntersHowl.html#_hunter-s-howl
piercing-shriek,Hurlement perçant,Piercing Shriek,um,"Sonic, Pain",Evocation,,,2,,,,,,,,,,,Verbal,Medium,une créature,SimpleAction,La cible est chancelante à cause d'un son douloureux.,http://www.pathfinder-fr.org/Wiki/Pathfinder-RPG.Hurlement perçant.ashx,http://paizo.com/pathfinderRPG/prd/ultimateMagic/spells/piercingShriek.html#_piercing-shriek
animal-trance,Hypnose des animaux,Animal Trance,,None,Enchantment,,,2,,2,,,,,,,,,"Verbal, Somatic",Close,animaux ou créatures magiques ayant 1 ou 2 en Intelligence,SimpleAction,Fascine 2d6 DV d'animaux.,http://www.pathfinder-fr.org/Wiki/Pathfinder-RPG.Hypnose des animaux.ashx,http://paizo.com/pathfinderRPG/prd/spells/animalTrance#animal-trance
hypnotism,Hypnose,Hypnotism,,MindAffecting,Enchantment,,,1,,,,,,,,,1,1,"Verbal, Somatic",Close,plusieurs créatures vivantes distantes de moins de 9 m (6 c) les unes des autres,1 Round,Fascine 2d4 DV de créatures.,http://www.pathfinder-fr.org/Wiki/Pathfinder-RPG.Hypnose.ashx,http://paizo.com/pathfinderRPG/prd/spells/hypnotism#hypnotism
primal-scream,Hurlement primitif,Primal Scream,um,"MindAffecting, Sonic",Abjuration,,,4,,,,,,,,,,,Verbal,Personal,lanceur de sorts,SimpleAction,Libère des effets d'enchantement et de paralysie.,http://www.pathfinder-fr.org/Wiki/Pathfinder-RPG.Hurlement primitif.ashx,http://paizo.com/pathfinderRPG/prd/ultimateMagic/spells/primalScream.html#_primal-scream
identify,Identification,Identify,,None,Divination,1,,1,,,,1,,,,,1,1,"Verbal, Somatic, Material",12 Squares,émanation en cône,SimpleAction,Bonus de +10 pour identifier un objet magique.,http://www.pathfinder-fr.org/Wiki/Pathfinder-RPG.Identification.ashx,http://paizo.com/pathfinderRPG/prd/spells/identify#identify
touch-of-idiocy,Idiotie,Touch Of Idiocy,,None,Enchantment,,,,,,,,,,,,2,2,"Verbal, Somatic",Touch,créature vivante touchée,SimpleAction,"Le sujet perd 1d6 points d'Int, de Sag et de Cha.",http://www.pathfinder-fr.org/Wiki/Pathfinder-RPG.Idiotie.ashx,http://paizo.com/pathfinderRPG/prd/spells/touchOfIdiocy#touch-of-idiocy
flare,Illumination,Flare,,None,Evocation,,,0,,0,,,0,,,,,0,Verbal,Close,rayonnement de lumière,SimpleAction,Éblouit la cible (-1 aux jets d'attaque).,http://www.pathfinder-fr.org/Wiki/Pathfinder-RPG.Illumination.ashx,http://paizo.com/pathfinderRPG/prd/spells/flare#flare
major-image,Image accomplie,Major Image,,None,Illusion,,,3,,,,,3,,,,,3,"Verbal, Somatic, Focus",Long,chimère visuelle ne pouvant occuper plus de 4 cubes de 3 m/2 c d’arête + 1 cube de 3 m/2 c d’arête par niveau (F),SimpleAction,"Comme image silencieuse, plus sons, odeurs et température.",http://www.pathfinder-fr.org/Wiki/Pathfinder-RPG.Image accomplie.ashx,http://paizo.com/pathfinderRPG/prd/spells/majorImage#major-image
shocking-image,Image de foudre,Shocking Image,uc,None,Illusion,,,4,,,,,,,,,,4,"Verbal, Somatic",Personal,lanceur de sorts,SimpleAction,Comme image miroir mais le double inflige des dégâts électriques quand on le détruit.,http://www.pathfinder-fr.org/Wiki/Pathfinder-RPG.Image de foudre.ashx,http://paizo.com/pathfinderRPG/prd/ultimateCombat/spells/shockingImage.html
minor-image,Image imparfaite,Minor Image,,None,Illusion,,,2,,,,,2,,,,,2,"Verbal, Somatic, Focus",Long,chimère visuelle ne pouvant occuper plus de 4 cubes de 3 m/2 c d’arête + 1 cube de 3 m/2 c d’arête par niveau (F),SimpleAction,"Comme image silencieuse, plus sons limités.",http://www.pathfinder-fr.org/Wiki/Pathfinder-RPG.Image imparfaite.ashx,http://paizo.com/pathfinderRPG/prd/spells/minorImage#minor-image
mirror-image,Image miroir,Mirror Image,,None,Illusion,,,2,,,,,2,,,,,2,"Verbal, Somatic",Personal,le jeteur de sorts,SimpleAction,Crée des doubles illusoires du PJ.,http://www.pathfinder-fr.org/Wiki/Pathfinder-RPG.Image miroir.ashx,http://paizo.com/pathfinderRPG/prd/spells/mirrorImage#mirror-image
permanent-image,Image permanente,Permanent Image,,None,Illusion,,,6,,,,,,,,,,6,"Verbal, Somatic, Focus",Long,chimère ne pouvant dépasser 1 cube de 6 m/4 c d’arête + 1 cube de 3 m/2 c d’arête par niveau (F),SimpleAction,"Illusion permanente qui comprend les aspects visuels, sonores et olfactifs et de température.",http://www.pathfinder-fr.org/Wiki/Pathfinder-RPG.Image permanente.ashx,http://paizo.com/pathfinderRPG/prd/spells/permanentImage#permanent-image
persistent-image,Image prédéterminée,Persistent Image,,None,Illusion,,,5,,,,,,,,,,5,"Verbal, Somatic, Focus",Long,chimère visuelle ne pouvant occuper plus de 4 cubes de 3 m/2 c d’arête + 1 cube de 3 m/2 c d’arête par niveau (F),SimpleAction,"Comme image accomplie, mais sans concentration.",http://www.pathfinder-fr.org/Wiki/Pathfinder-RPG.Image prédéterminée.ashx,http://paizo.com/pathfinderRPG/prd/spells/persistentImage#persistent-image
programmed-image,Image programmée,Programmed Image,,None,Illusion,,,6,,,,,,,,,,6,"Verbal, Somatic, Material",Long,chimère ne pouvant dépasser 1 cube de 6 m/4 c d’arête + 1 cube de 3 m/2 c d’arête/niveau (F),SimpleAction,"Comme image accomplie, mais déclenchée par condition.",http://www.pathfinder-fr.org/Wiki/Pathfinder-RPG.Image programmée.ashx,http://paizo.com/pathfinderRPG/prd/spells/programmedImage#programmed-image
silent-image,Image silencieuse,Silent Image,,None,Illusion,,,1,,,,,1,,,,,1,"Verbal, Somatic, Focus",Long,chimère visuelle ne pouvant occuper plus de 4 cubes de 3 m/2 c d’arête + 1 cube de 3 m/2 c d’arête par niveau (F),SimpleAction,Illusion visuelle mineure.,http://www.pathfinder-fr.org/Wiki/Pathfinder-RPG.Image silencieuse.ashx,http://paizo.com/pathfinderRPG/prd/spells/silentImage#silent-image
hold-animal,Immobilisation d'animal,Hold Animal,,None,Enchantment,,,,,2,,,,,,2,,,"Verbal, Somatic",Medium,1 animal,SimpleAction,Immobilise un animal pour 1 round/niveau.,http://www.pathfinder-fr.org/Wiki/Pathfinder-RPG.Immobilisation danimal.ashx,http://paizo.com/pathfinderRPG/prd/spells/holdAnimal#hold-animal
hold-monster-mass,Immobilisation de monstre de groupe,"Hold Monster, Mass",,None,Enchantment,,,,,,,,,,,,9,9,"Verbal, Somatic, FocusOrDivineFocus",Medium,"1 ou plusieurs créatures, distantes de moins de 9 m/6 c les unes des autres",SimpleAction,"Comme immobilisation de monstre, mais sur 9 m de rayon.",http://www.pathfinder-fr.org/Wiki/Pathfinder-RPG.Immobilisation de monstre de groupe.ashx,http://paizo.com/pathfinderRPG/prd/spells/holdMonster#hold-monster-mass
hold-monster,Immobilisation de monstre,Hold Monster,,None,Enchantment,,,4,,,4,4,,,,,5,5,"Verbal, Somatic, FocusOrDivineFocus",Medium,1 créature vivante,SimpleAction,Immobilise n'importe quelle créature.,http://www.pathfinder-fr.org/Wiki/Pathfinder-RPG.Immobilisation de monstre.ashx,http://paizo.com/pathfinderRPG/prd/spells/holdMonster#hold-monster
halt-undead,Immobilisation de morts-vivants,Halt Undead,,None,Necromancy,,,,,,3,,,,,,,3,"Verbal, Somatic, Material",Medium,jusqu’à 3 morts-vivants distants de moins de 9 m/6 c les uns des autres,SimpleAction,Stoppe les morts-vivants pendant 1 round/niveau.,http://www.pathfinder-fr.org/Wiki/Pathfinder-RPG.Immobilisation de morts-vivants.ashx,http://paizo.com/pathfinderRPG/prd/spells/haltUndead#halt-undead
hold-person-mass,Immobilisation de personne de groupe,"Hold Person, Mass",,None,Enchantment,,,,,,,,,,,,7,7,"Verbal, Somatic, FocusOrDivineFocus",Medium,"1 ou plusieurs humanoïdes, distants de moins de 9 m/6 c les uns des autres",SimpleAction,"Comme immobilisation de personne, mais dans un rayon de 9 m.",http://www.pathfinder-fr.org/Wiki/Pathfinder-RPG.Immobilisation de personne de groupe.ashx,http://paizo.com/pathfinderRPG/prd/spells/holdPerson#hold-person-mass
hold-person,Immobilisation de personne,Hold Person,,None,Enchantment,,2,2,2,,2,,,,,,2,3,"Verbal, Somatic, FocusOrDivineFocus",Medium,1 humanoïde,SimpleAction,Immobilise un humanoïde pendant 1 round/niveau.,http://www.pathfinder-fr.org/Wiki/Pathfinder-RPG.Immobilisation de personne.ashx,http://paizo.com/pathfinderRPG/prd/spells/holdPerson#hold-person
spontaneous-immolation,Immolation spontanée,Spontaneous Immolation,uc,None,Evocation,,,,,,,,,,,,,2,"Verbal, Somatic, Focus",Medium,une créature,SimpleAction,La cible subit 3d6 points de dégâts de feu et s’enflamme.,http://www.pathfinder-fr.org/Wiki/Pathfinder-RPG.Immolation spontanée.ashx,http://paizo.com/pathfinderRPG/prd/ultimateCombat/spells/spontaneousImmolation.html
spell-immunity,Immunité contre les sorts,Spell Immunity,,None,Abjuration,4,,,4,,4,,,,,,,,"Verbal, Somatic, DivineFocus",Touch,créature touchée,SimpleAction,Immunise le sujet contre 1 sort/4 niveaux.,http://www.pathfinder-fr.org/Wiki/Pathfinder-RPG.Immunité contre les sorts.ashx,http://paizo.com/pathfinderRPG/prd/spells/spellImmunity#spell-immunity
spell-immunity-communal,Immunité contre les sorts (partagé),"Spell Immunity, Communal",uc,None,Abjuration,,,,5,,5,,,,,,,,"Verbal, Somatic, DivineFocus",Touch,créatures touchées,SimpleAction,Comme  immunité contre les sorts mais la durée d’effet se divise entre les créatures touchées.,http://www.pathfinder-fr.org/Wiki/Pathfinder-RPG.Immunité contre les sorts (partagé).ashx,http://paizo.com/pathfinderRPG/prd/ultimateCombat/spells/spellImmunity.html
spell-immunity-greater,Immunité contre les sorts suprême,"Spell Immunity, Greater",,None,Abjuration,,,,8,,,,,,,,,,"Verbal, Somatic, DivineFocus",Touch,créature touchée,SimpleAction,"Comme immunité contre les sorts, mais jusqu'au 8e niveau.",http://www.pathfinder-fr.org/Wiki/Pathfinder-RPG.Immunité contre les sorts suprême.ashx,http://paizo.com/pathfinderRPG/prd/spells/spellImmunity#spell-immunity-greater
spell-immunity-greater-communal,Immunité contre les sorts suprême (partagé),"Spell Immunity, Greater Communal",uc,None,Abjuration,,,,9,,,,,,,,,,"Verbal, Somatic, DivineFocus",Touch,créatures touchées,SimpleAction,Comme immunité contre les sorts suprême mais la durée d’effet se divise entre les créatures touchées.,http://www.pathfinder-fr.org/Wiki/Pathfinder-RPG.Immunité contre les sorts suprême (partagé).ashx,http://paizo.com/pathfinderRPG/prd/ultimateCombat/spells/spellImmunity.html
implosion,Implosion,Implosion,,None,Evocation,,,,9,,,,,,,,,,"Verbal, Somatic",Close,1 créature tangible/round,SimpleAction,Inflige 10 pts de dégâts/niveau à une créature/round.,http://www.pathfinder-fr.org/Wiki/Pathfinder-RPG.Implosion.ashx,http://paizo.com/pathfinderRPG/prd/spells/implosion#implosion
bane,Imprécation,Bane,,"Fear, MindAffecting, Emotion",Enchantment,,1,,1,,1,,,,,,,,"Verbal, Somatic, DivineFocus",10 Squares,tous les adversaires se trouvant à 15 m (10 c) ou moins,SimpleAction,Les adversaires subissent -1 à l'attaque et aux jets de sauvegarde contre la terreur.,http://www.pathfinder-fr.org/Wiki/Pathfinder-RPG.Imprécation.ashx,http://paizo.com/pathfinderRPG/prd/spells/bane#bane
imbue-with-aura,imprégner d'aura,Imbue with Aura,um,None,Transmutation,,,,2,,,,,,,,,,"Verbal, Somatic, DivineFocus",Close,une créature,SimpleAction,La cible imite l'aura du prêtre.,http://www.pathfinder-fr.org/Wiki/Pathfinder-RPG.imprégner daura.ashx,http://paizo.com/pathfinderRPG/prd/ultimateMagic/spells/imbueWithAura.html#_imbue-with-aura
tireless-pursuit,Infatigable poursuivant,Tireless Pursuit,apg,None,Transmutation,,,,,,1,,,,,1,,,"Verbal, Somatic",Personal,lanceur de sorts,SimpleAction,Le personnage ignore la fatigue quand il court en petites foulées.,http://www.pathfinder-fr.org/Wiki/Pathfinder-RPG.Infatigable poursuivant.ashx,http://paizo.com/pathfinderRPG/prd/advanced/spells/tirelessPursuit.html#_tireless-pursuit
tireless-pursuers,Infatigables poursuivants,Tireless Pursuers,apg,None,Transmutation,,,,,,4,,,,,3,,,"Verbal, Somatic",Touch,lanceur de sorts plus 1 créature touchée/3 niveaux,SimpleAction,Comme infatigable poursuivant mais affecte plusieurs créatures.,http://www.pathfinder-fr.org/Wiki/Pathfinder-RPG.Infatigables poursuivants.ashx,http://paizo.com/pathfinderRPG/prd/advanced/spells/tirelessPursuers.html#_tireless-pursuers
fleshworm-infestation,Infestation de vers,Fleshworm Infestation,um,Evil,Conjuration,,,,4,,4,,,,,,4,4,"Verbal, Somatic",Touch,une créature touchée,SimpleAction,Des vers infligent des dégâts et un affaiblissement de Dex.,http://www.pathfinder-fr.org/Wiki/Pathfinder-RPG.Infestation de vers.ashx,http://paizo.com/pathfinderRPG/prd/ultimateMagic/spells/fleshwormInfestation.html#_fleshworm-infestation
fungal-infestation,Infestation fongique,Fungal Infestation,um,Disease,Necromancy,,,,,3,,,,,,,,,"Verbal, Somatic",Touch,une créature touchée,SimpleAction,La cible saigne quand on l'attaque.,http://www.pathfinder-fr.org/Wiki/Pathfinder-RPG.Infestation fongique.ashx,http://paizo.com/pathfinderRPG/prd/ultimateMagic/spells/fungalInfestation.html#_fungal-infestation
touch-injection,Injection,Touch Injection,uc,None,Transmutation,2,,,,,,,,,,,,3,"Verbal, Somatic",Personal,le jeteur de sorts,SimpleAction,"Le personnage peut administrer une infusion, un élixir, un poison ou une potion par une attaque de contact.",http://www.pathfinder-fr.org/Wiki/Pathfinder-RPG.Injection.ashx,http://paizo.com/pathfinderRPG/prd/ultimateCombat/spells/touchInjection.html
command-greater,Injonction suprême,"Command, Greater",,None,Enchantment,,,,5,,5,,,,,,,,Verbal,Close,"1 créature/niveau, distantes de moins de 9 m/6 c les unes des autres",SimpleAction,"Comme injonction, mais affecte un sujet/niveau.",http://www.pathfinder-fr.org/Wiki/Pathfinder-RPG.Injonction suprême.ashx,http://paizo.com/pathfinderRPG/prd/spells/command#command-greater
command,Injonction,Command,,None,Enchantment,,1,,1,,1,,,,,,1,,Verbal,Close,1 créature vivante,SimpleAction,La cible obéit à un ordre d'un mot pendant 1 round.,http://www.pathfinder-fr.org/Wiki/Pathfinder-RPG.Injonction.ashx,http://paizo.com/pathfinderRPG/prd/spells/command#command
innocence,Innocence,Innocence,apg,None,Transmutation,,,1,,,,,,,,,,,"Verbal, Somatic",Personal,lanceur de sorts,SimpleAction,Gagne +10 aux tests de Bluff pour paraître innocent.,http://www.pathfinder-fr.org/Wiki/Pathfinder-RPG.Innocence.ashx,http://paizo.com/pathfinderRPG/prd/advanced/spells/innocence.html#_innocence
countless-eyes,Innombrables yeux,Countless Eyes,um,None,Transmutation,3,,,,,3,,,,,,3,3,"Verbal, Somatic",Touch,une créature touchée,SimpleAction,Des yeux supplémentaires donnent la vision à 360°.,http://www.pathfinder-fr.org/Wiki/Pathfinder-RPG.Innombrables yeux.ashx,http://paizo.com/pathfinderRPG/prd/ultimateMagic/spells/countlessEyes.html#_countless-eyes
sift,Inspection,Sift,apg,None,Divination,,,0,,,0,,,,,,,,"Verbal, Somatic",6 Squares,cube de 3 m (2 c) de côté,SimpleAction,Gagne +10 aux tests de Bluff pour paraître innocent.,http://www.pathfinder-fr.org/Wiki/Pathfinder-RPG.Inspection.ashx,http://paizo.com/pathfinderRPG/prd/advanced/spells/sift.html#_sift
brilliant-inspiration,Inspiration brillante,Brilliant Inspiration,apg,LanguageDependent,Evocation,,,6,,,,,,,,,,,Verbal,Close,une créature vivante,SimpleAction,Le personnage lance deux d20 et choisit le meilleur.,http://www.pathfinder-fr.org/Wiki/Pathfinder-RPG.Inspiration brillante.ashx,http://paizo.com/pathfinderRPG/prd/advanced/spells/brilliantInspiration.html#_brilliant-inspiration
gallant-inspiration,Inspiration galante,Gallant Inspiration,apg,None,Divination,,,2,,,,,,,,,,,Verbal,Close,une créature vivante,ImmediateAction,Bonus d’attaque de +2d4 aux jets d’attaque ratés ou aux tests de compétence ratés.,http://www.pathfinder-fr.org/Wiki/Pathfinder-RPG.Inspiration galante.ashx,http://paizo.com/pathfinderRPG/prd/advanced/spells/gallantInspiration.html#_gallant-inspiration
timely-inspiration,Inspiration opportune,Timely Inspiration,apg,None,Divination,,,1,,,,,,,,,,,Verbal,Close,une créature,ImmediateAction,Donne un bonus sur un test/jet d’attaque raté.,http://www.pathfinder-fr.org/Wiki/Pathfinder-RPG.Inspiration opportune.ashx,http://paizo.com/pathfinderRPG/prd/advanced/spells/timelyInspiration.html#_timely-inspiration
moment-of-greatness,Instant de gloire,Moment of Greatness,uc,None,Enchantment,,,1,1,,,,,,,,,1,"Verbal, Somatic, FocusOrDivineFocus",10 Squares,lanceur de sorts et les alliés situés dans un rayon de 15 m (10 c) autour du lanceur de sorts,SimpleAction,Double un bonus de moral.,http://www.pathfinder-fr.org/Wiki/Pathfinder-RPG.Instant de gloire.ashx,http://paizo.com/pathfinderRPG/prd/ultimateCombat/spells/momentOfGreatness.html
instrument-of-agony,Instrument d'agonie,Instrument of Agony,uc,None,Transmutation,,,,2,,2,,2,,,,,,"Verbal, Somatic",Touch,arme touchée,SimpleAction,L’arme émet une fureur divine qui donne un bonus aux tests d’Intimidation.,http://www.pathfinder-fr.org/Wiki/Pathfinder-RPG.Instrument dagonie.ashx,http://paizo.com/pathfinderRPG/prd/ultimateCombat/spells/instrumentOfAgony.html
fool's-forbiddance,Interdiction du fou,Fool's Forbiddance,apg,None,Abjuration,,,6,,,,,,,,,,,"Verbal, Somatic, Material",2 Squares,émanation sphérique de 3 m (2 c) de rayon centrée sur le lanceur de sorts,SimpleAction,Les ennemis qui approchent à portée d’une émanation centrée sur le personnage sont confus.,http://www.pathfinder-fr.org/Wiki/Pathfinder-RPG.Interdiction du fou.ashx,http://paizo.com/pathfinderRPG/prd/advanced/spells/foolsForbiddance.html#_fool-s-forbiddance
forbiddance,Interdiction,Forbiddance,,None,Abjuration,,,,6,,6,,,,,,,,"Verbal, Somatic, Material",Medium,1 cube de 18 m/12 c d’arête par niveau (F),6 Round,"Bloque les déplacements planaires, blesse les créatures d'un alignement différent.",http://www.pathfinder-fr.org/Wiki/Pathfinder-RPG.Interdiction.ashx,http://paizo.com/pathfinderRPG/prd/spells/forbiddance#forbiddance
interrogation-greater,Interrogatoire supérieur,"Interrogation, Greater",um,None,Necromancy,,,,,,4,,,,,,,,"Verbal, Somatic",Touch,une créature vivante touchée,1 Round,Comme  interrogatoire mais avec plus de douleur et de questions.,http://www.pathfinder-fr.org/Wiki/Pathfinder-RPG.Interrogatoire supérieur.ashx,"http://paizo.com/pathfinderRPG/prd/ultimateMagic/spells/interrogation.html#_interrogation,-greater"
interrogation,Interrogatoire,Interrogation,um,None,Necromancy,,,,,,1,,,,,,1,1,"Verbal, Somatic",Touch,une créature vivante touchée,1 Round,La cible répond aux questions ou souffre.,http://www.pathfinder-fr.org/Wiki/Pathfinder-RPG.Interrogatoire.ashx,http://paizo.com/pathfinderRPG/prd/ultimateMagic/spells/interrogation.html#_interrogation
burst-of-nettles,Invasion d'orties,Burst of Nettles,um,Acid,Conjuration,,,,,3,,,,,,,,,"Verbal, Somatic",Close,rayon de 3 m,SimpleAction,Une explosion inflige 3d6 points de dégâts et 1d6 d'acide.,http://www.pathfinder-fr.org/Wiki/Pathfinder-RPG.Invasion dorties.ashx,http://paizo.com/pathfinderRPG/prd/ultimateMagic/spells/burstOfNettles.html#_burst-of-nettles
blistering-invective,Invective cuisante,Blistering Invective,uc,None,Evocation,2,,2,,,2,,,,,,,,"Verbal, Somatic",Personal,9 m (6 c) de rayon,SimpleAction,Le personnage fait un test d’Intimidation contre tous les adversaires situés dans les 9 (M). Ceux qu’il démoralise subissent des dégâts de feu.,http://www.pathfinder-fr.org/Wiki/Pathfinder-RPG.Invective cuisante.ashx,http://paizo.com/pathfinderRPG/prd/ultimateCombat/spells/blisteringInvective.html
reverse-gravity,Inversion de la gravité,Reverse Gravity,,None,Transmutation,,,,,8,,,,,,,,7,"Verbal, Somatic, FocusOrDivineFocus",Medium,jusqu’à 1 cube de 3 m/2 c d’arête par 2 niveaux (F),SimpleAction,Objets et créatures tombent vers le haut.,http://www.pathfinder-fr.org/Wiki/Pathfinder-RPG.Inversion de la gravité.ashx,http://paizo.com/pathfinderRPG/prd/spells/reverseGravity#reverse-gravity
invisibility-mass,Invisibilité de groupe,"Invisibility, Mass",,None,Illusion,,,,,,,5,,,,,,7,"Verbal, Somatic, FocusOrDivineFocus",Long,créatures distantes de 54 m/36 c ou moins les unes des autres,SimpleAction,"Comme invisibilité, mais multiples sujets.",http://www.pathfinder-fr.org/Wiki/Pathfinder-RPG.Invisibilité de groupe.ashx,http://paizo.com/pathfinderRPG/prd/spells/invisibility#invisibility-mass
hide-from-animals,Invisibilité pour les animaux,Hide From Animals,,None,Abjuration,,,,,1,,,,,,1,,,"Somatic, DivineFocus",Touch,1 créature touchée/niveau,SimpleAction,Les animaux ne voient pas un sujet/niveau.,http://www.pathfinder-fr.org/Wiki/Pathfinder-RPG.Invisibilité pour les animaux.ashx,http://paizo.com/pathfinderRPG/prd/spells/hideFromAnimals#hide-from-animals
hide-from-undead,Invisibilité pour les morts-vivants,Hide From Undead,,None,Abjuration,,,,1,,1,,,,,,,,"Verbal, Somatic, DivineFocus",Touch,1 créature touchée/niveau,SimpleAction,Les morts-vivants ne voient pas les sujets (1/niveau).,http://www.pathfinder-fr.org/Wiki/Pathfinder-RPG.Invisibilité pour les morts-vivants.ashx,http://paizo.com/pathfinderRPG/prd/spells/hideFromUndead#hide-from-undead
invisibility-greater,Invisibilité suprême,"Invisibility, Greater",,None,Illusion,4,4,4,,,4,3,4,,,,,4,"Verbal, Somatic",Présentation des sorts#PORTEE|personnelle ou Présentation des sorts#PORTEE|contact,le jeteur de sort ou la créature touchée,SimpleAction,"Comme invisibilité, mais continue quand le sujet attaque.",http://www.pathfinder-fr.org/Wiki/Pathfinder-RPG.Invisibilité suprême.ashx,http://paizo.com/pathfinderRPG/prd/spells/invisibility#invisibility-greater
invisibility,Invisibilité,Invisibility,,None,Illusion,2,2,2,,,2,2,2,,,,,2,"Verbal, Somatic, FocusOrDivineFocus",Présentation des sorts#PORTEE|personnelle ou Présentation des sorts#PORTEE|contact,le jeteur de sorts ou 1 créature (ou 1 objet) ne pesant pas plus de 50 kg/niveau,SimpleAction,Sujet invisible pendant 1 minute/niveau ou jusqu'à ce qu'il attaque.,http://www.pathfinder-fr.org/Wiki/Pathfinder-RPG.Invisibilité.ashx,http://paizo.com/pathfinderRPG/prd/spells/invisibility#invisibility
heroic-invocation,Invocation héroïque,Heroic Invocation,uc,None,Enchantment,,,,,,,,,,,,9,9,"Verbal, Somatic",Close,"une créature ou plus, qui ne doivent être distantes de plus de 9 m (6 c) les unes des autres",10 Minute,"Des créatures bénéficient de bonus aux jets d’attaque et de dégâts, de points de vie temporaires et d’une immunité contre les effets de peur et de charme.",http://www.pathfinder-fr.org/Wiki/Pathfinder-RPG.Invocation héroïque.ashx,http://paizo.com/pathfinderRPG/prd/ultimateCombat/spells/heroicInvocation.html
instant-summons,Invocation instantanée,Instant Summons,,None,Conjuration,,,,,,,6,,,,,7,7,"Verbal, Somatic, Material",voir description,"1 objet pesant jusqu’à 5 kg, dont la plus longue dimension ne doit pas dépasser 1,80 m",SimpleAction,L'objet préparé apparaît dans la main du PJ.,http://www.pathfinder-fr.org/Wiki/Pathfinder-RPG.Invocation instantanée.ashx,http://paizo.com/pathfinderRPG/prd/spells/instantSummons#instant-summons
acidic-spray,Jet d'acide,Acidic Spray,um,None,Conjuration,,,,,,,,5,,,,,5,"Verbal, Somatic, Material",12 Squares,ligne de 18 m (12 c),SimpleAction,1d6 points de dégâts d'acide/niveau plus 1 round d'acide.,http://www.pathfinder-fr.org/Wiki/Pathfinder-RPG.Jet dacide.ashx,http://paizo.com/pathfinderRPG/prd/ultimateMagic/spells/acidicSpray.html#_acidic-spray
firefall,Jet de flammes,Firefall,apg,None,Transmutation,,,,,,,,4,,,,,4,"Verbal, Somatic, Material",Long,"une source de feu, jusqu'à 0,60 mètres cube",SimpleAction,Des flammes jaillissent et infligent 2d6 points de dégâts.,http://www.pathfinder-fr.org/Wiki/Pathfinder-RPG.Jet de flammes.ashx,http://paizo.com/pathfinderRPG/prd/advanced/spells/firefall.html#_firefall
youthful-appearance,Jeunesse apparente,Youthful Appearance,um,None,Transmutation,1,,1,,,,,,,,,1,1,"Verbal, Somatic",Touch,une créature touchée,SimpleAction,La cible semble plus jeune.,http://www.pathfinder-fr.org/Wiki/Pathfinder-RPG.Jeunesse apparente.ashx,http://paizo.com/pathfinderRPG/prd/ultimateMagic/spells/youthfulAppearance.html#_youthful-appearance
play-instrument,Jouer d'un instrument,Play Instrument,um,None,Divination,,,1,,,,,,,,,,,"Verbal, Somatic",Personal,lanceur de sorts,SimpleAction,Le personnage joue d'un instrument comme s'il avait appris.,http://www.pathfinder-fr.org/Wiki/Pathfinder-RPG.Jouer dun instrument.ashx,http://paizo.com/pathfinderRPG/prd/ultimateMagic/spells/playInstrument.html#_play-instrument
pied-piping,Joueur de flûte,Pied Piping,apg,None,Enchantment,,,6,,,,,,,,,,,Verbal,20 Squares,émanation de 30 m (20 c) de rayon centrée sur le lanceur de sorts,SimpleAction,Oblige des créatures similaires similaires à vous suivre.,http://www.pathfinder-fr.org/Wiki/Pathfinder-RPG.Joueur de flûte.ashx,http://paizo.com/pathfinderRPG/prd/advanced/spells/piedPiping.html#_pied-piping
deadly-juggernaut,Juggernaut mortel,Deadly Juggernaut,uc,None,Necromancy,,3,,3,,3,,,,3,,,,"Verbal, Somatic",Personal,lanceur de sorts,SimpleAction,La puissance du personnage augmente à chaque fois qu’il tue.,http://www.pathfinder-fr.org/Wiki/Pathfinder-RPG.Juggernaut mortel.ashx,http://paizo.com/pathfinderRPG/prd/ultimateCombat/spells/deadlyJuggernaut.html
